article_title,article_headline,article_content,text_date,article_url,credit_suisse_count,cs_count,word_count,Sentiment
Credit Suisse shares soar over 18% on Swiss National Bank loan announcement,"Credit Suisse shares rose over 30% at the market open after the bank said that it will borrow up to $54 billion from the Swiss National Bank.It comes after shares of Credit Suisse plunged to a fresh all-time low on Wednesday when top investor the Saudi National Bank said it would not pump in any more cash due to regulatory restrictions.The Swiss National Bank and the Swiss Financial Market Supervisory Authority said in a statement that Credit Suisse ""meets the capital and liquidity requirements imposed on systemically important banks.""","In this article Credit Suisse shares soared more than 30% at Thursday's market open after the bank said it will borrow up to 50 billion Swiss francs ($54 billion) from the Swiss National Bank. The Swiss-listed stock's rally cooled slightly during the day's trading, but the shares were still up 18.8% as markets closed in the afternoon. The embattled lender announced late Wednesday that it would exercise its option to borrow from the Swiss central bank under a covered loan facility and a short-term liquidity facility. The Swiss National Bank and the Swiss Financial Market Supervisory Authority said in a statement Wednesday that Credit Suisse ""meets the capital and liquidity requirements imposed on systemically important banks."" Credit Suisse also offered to buy back around 3 billion francs' worth of debt, relating to 10 U.S. dollar-denominated senior debt securities and four euro-denominated senior debt securities. ""These measures demonstrate decisive action to strengthen Credit Suisse as we continue our strategic transformation to deliver value to our clients and other stakeholders,"" Credit Suisse CEO Ulrich Koerner said in the release Wednesday. ""We thank the [Swiss National Bank] and FINMA as we execute our strategic transformation. My team and I are resolved to move forward rapidly to deliver a simpler and more focused bank built around client needs."" The stock of Credit Suisse, Switzerland's second-largest bank, began to slide at the start of the week, along with many other European banks, on fears of contagion in light of the collapse of Silicon Valley Bank. The Swiss bank's losses deepened on Tuesday after it announced in its delayed annual report that ""material weakness"" had been found in its financial reporting in 2021 and 2022, although it said this did not affect the accuracy of the bank's financial statements. Credit Suisse's shares plunged to a fresh all-time low for the second consecutive day on Wednesday after the Saudi National Bank — a top investor — said it would not pump in any more cash due to regulatory restrictions. The Saudi National Bank took a 9.9% stake in Credit Suisse as part of the lender's $4.2 billion capital raise to fund a massive strategic overhaul, aimed at improving investment banking performance and addressing a litany of risk and compliance failures.",2023-03-16 00:00:00+00:00,https://www.cnbc.com/2023/03/16/credit-suisse-shares-soar-30percent-on-swiss-national-bank-loan-announcement.html?&qsearchterm=,8,0,373,"-1. Article highlights financial instability and emergency measures, casting a negative light on Credit Suisse."
'The weakest links are cracking': Investors consider possible Credit Suisse contagion,"Shares of Credit Suisse surged higher Thursday, rebounding from a fresh all-time low after the beleaguered lender received central bank support to shore up its finances.The abrupt loss of confidence in Credit Suisse, which comes as fears about the health of the banking system spread from the U.S. to Europe, has prompted some to question the ""true"" worth of Credit Suisse's share price.""The weakest links are cracking and that's just happening, and that was entirely predictable — and this will not be the last one,"" Beat Wittmann, chairman of Switzerland's Porta Advisors, told CNBC's ""Squawk Box Europe"" on Thursday.","In this article Shares of Credit Suisse surged Thursday, rebounding from a fresh all-time low after the beleaguered lender announced it would tap central bank support to shore up its finances. Switzerland's second-largest bank said it would borrow up to 50 billion Swiss francs ($53.68 billion) from the Swiss National Bank, providing a moment of relief for investors after the Zurich-headquartered firm led Europe's banking sector on a wild ride lower during the previous session. The Swiss-listed stock was trading around 17% higher at 1:35 p.m. London time (9:35 a.m. ET) — a massive swing from Wednesday's more than 30% tumble after its biggest backer said it wouldn't provide further assistance due to regulatory restrictions. The abrupt loss of confidence in Credit Suisse, which came as fears about the health of the banking system spread from the U.S. to Europe, has prompted some to question the ""true"" worth of Credit Suisse's stock price. ""We have to step back and look of course at the viability of the business model [and] at the overall regulatory landscape,"" Beat Wittmann, chairman of Switzerland's Porta Advisors, told CNBC's ""Squawk Box Europe"" on Thursday. ""I think the leadership of the bank has to really use now this lifeline to review their plan because obviously, the capital markets have not bought the plan as we have seen by the performances of the equity price and the credit default swaps very recently."" Asked for his views on the sharp fall of Credit Suisse's share price — which dropped below 2 Swiss francs for the first time on Wednesday — Wittmann said a ""brutal"" monetary tightening cycle led by major central banks in recent months meant companies vulnerable to shocks were now beginning to ""really suffer."" ""The weakest links are cracking and that's just happening, and that was entirely predictable — and this will not be the last one. So, now it is really time for policymakers to restore confidence and liquidity in the system, be it in the U.S., be it in Switzerland, or be it somewhere else,"" Wittmann said. Asked for his advice to investors amid the market turmoil, he said, ""The upside momentum in inflation and interest rates is receding very clearly so I think there is a very healthy underpinning in capital markets."" ""But I would very strongly recommend sticking to high-quality companies — that means strong management, strong balance sheets, strong value proposition. And now you can pick them up at more attractive valuations,"" Wittmann added. Even before the shock collapse of two U.S. banks last week, Credit Suisse has been beset with problems in recent years, including money laundering charges and spying allegations. The bank's disclosure earlier this week of ""material weaknesses"" in its reporting added to investor concerns. Credit Suisse management said Wednesday, however, that its latest step to secure a sizable funding deal showed ""decisive action"" to strengthen the business. It thanked the Swiss National Bank and the Swiss Financial Market Supervisory Authority for their support. Analysts welcomed the move and suggested fears of a fresh banking crisis may be overstated. ""A stronger liquidity position and a backstop provided by the Swiss National Bank with the support from Finma are positive,"" Anke Reingen, an analyst at RBC Capital Markets, said Thursday in a research note. ""Regaining trust is key for the CS shares. Measures taken should provide some comfort that a spillover to the sector could be contained, but the situation remains uncertain,"" she added. Analysts at UBS, meanwhile, said market participants were ""grappling with three interrelated but different issues: bank solvency, bank liquidity, and bank profitability."" ""In short, we think bank solvency fears are overdone, and most banks retain strong liquidity positions,"" they added. For Dan Scott, head of multi-asset management at Swiss asset manager Vontobel — who used to work at Credit Suisse — it's not all bad news. ""I would say that Credit Suisse specifically is still one of the world's largest asset managers, it has half a trillion in assets, and certainly this could be a great turnaround story if the execution is good,"" he told ""Squawk Box Europe"" on Thursday. Asked by CNBC's Geoff Cutmore whether this would mean investors staying patient despite market turbulence and the scale of outflows from the bank, Scott replied: ""Absolutely. But I think again that the stress that we're seeing at the moment really should have been predictable."" ""When rates come up so fast, certain business models get challenged and I don't think it is a wealth management business model that gets challenged. I think much more and why we saw it at Silicon Valley Bank, is private markets are going to be challenged,"" Scott added.",2023-03-16 00:00:00+00:00,https://www.cnbc.com/2023/03/16/credit-suisse-investors-wary-of-contagion-amid-banking-crisis-fears.html?&qsearchterm=,8,1,777,-1. Article highlights ongoing financial struggles and uncertainties surrounding Credit Suisse's future stability.
Saudi National Bank says panic over Credit Suisse is 'unwarranted',"Chairman Ammar Al Khudairy of Saudi National Bank described the latest markets turmoil following Credit Suisse's stock plunge as ""a little bit of panic.""He added that the recent fallout of the collapse of Silicon Valley Bank was different from the 2008 financial crisis.He told CNBC's ""Capital Connection"" that he believes U.S. regulators ""have cut off any possibilities of a spillover.""","In this article Credit Suisse's largest shareholder Saudi National Bank said the market turmoil in shares of the Swiss lender was ""unwarranted."" ""If you look at how the entire banking sector has dropped, unfortunately, a lot of people were just looking for excuses,"" Saudi National Bank chairman Ammar Al Khudairy told CNBC's Hadley Gamble on Thursday. ""It's panic, a little bit of panic. I believe completely unwarranted, whether it be for Credit Suisse or for the entire market,"" he said on CNBC's ""Capital Connection."" His comments come hours after Credit Suisse announced that it is taking ""decisive action"" to borrow up to 50 billion Swiss francs ($53.68 billion). The lender's shares plunged Wednesday after a report that the Saudi bank said it could not provide Credit Suisse with any further financial assistance. He added that the recent fallout of the collapse of Silicon Valley Bank was different from the 2008 financial crisis, saying that steps taken by U.S. regulators to protect depositors have contained further fears of contagion. ""We did have a failure last week, but that's nowhere near, nothing to do with what we saw in 2008. This is just one isolated incident, the regulators have cut off any possibilities of a spillover,"" he said. The chairman of Saudi National Bank told CNBC that Credit Suisse has not asked for financial assistance. ""There has been no discussions with Credit Suisse about providing assistance,"" he said. ""I don't know where the word 'assistance' came from, there has been no discussions whatsoever since October,"" he said. He reiterated that the bank will not take its stake beyond the current 9.9%. ""The message has not changed, it's the same since October,"" he said. ""Even if we desired to, there are too many complications from a regulatory and compliance point of view,"" he said.",2023-03-16 00:00:00+00:00,https://www.cnbc.com/2023/03/16/saudi-national-bank-says-panic-over-credit-suisse-is-unwarranted.html?&qsearchterm=,6,0,301,"0. The article presents both concerns and reassurances, balancing negative and positive sentiments."
Credit Suisse sheds another 8% as traders digest emergency liquidity,The bank's stock started sliding earlier in the week after the Saudi National Bank revealed it would not provide the bank with any more cash due to regulatory requirements.The bank is undergoing a massive strategic overhaul aimed at restoring stability and profitability after a litany of losses and scandals — but capital markets and stakeholders appear unconvinced.,"In this article Credit Suisse shares fell 8% on Friday, after soaring over the previous session as the embattled lender said it will borrow up to 50 billion Swiss francs ($54 billion) from the Swiss National Bank. This week's intervention by Swiss authorities, which also reaffirmed that Credit Suisse met the capital and liquidity requirements imposed on ""systemically important banks,"" prompted shares to jump more than 18% on Thursday after closing at an all-time low on Wednesday. Credit Suisse also offered to buy back around 3 billion francs' worth of debt, relating to 10 U.S. dollar-denominated senior debt securities and four euro-denominated senior debt securities. The slide to Wednesday's low came after top investor the Saudi National Bank revealed it would not provide the bank with any more cash due to regulatory requirements, compounding a downward spiral in Credit Suisse's share price that began with the delay of its annual results over financial reporting concerns. The bank's Swiss-listed shares ended the week down 25.5%. The bank is undergoing a massive strategic overhaul aimed at restoring stability and profitability after a litany of losses and scandals. The restructure involves the spin-off of the investment bank to form U.S.-based CS First Boston, a steep reduction in exposure to risk-weighted assets, and a $4.2 billion capital raise funded in part by the 9.9% stake acquired by the Saudi National Bank. However, capital markets and stakeholders appear unconvinced. The share price has fallen sharply over the last year and Credit Suisse has seen huge outflows in assets under management, losing around 38% of its deposits in the fourth quarter of 2022. Credit default swaps, which insure bondholders against a company defaulting, soared to new record highs this week. According to the CDS rate, the bank's default risk has surged to crisis levels, with the 1-year CDS rate jumping by almost 33 percentage points to 38.4% on Wednesday, before finishing Thursday at 34.2%. Charles-Henry Monchau, chief investment officer at Syz Bank, said Credit Suisse needs to go further to restore investor confidence. ""This support from the SNB and the statement from regulators indicate that Credit Suisse in its current form will continue,"" he said in a note Thursday. ""However, these measures are not sufficient for Credit Suisse to be completely out of trouble; it is about restoring market confidence through the complete exit of the investment bank, a full guarantee on all deposits by the SNB, and an injection of equity capital to give Credit Suisse time to restructure."" Correction: This story has been updated with the correct weekly fall for Credit Suisse.",2023-03-17 00:00:00+00:00,https://www.cnbc.com/2023/03/17/credit-suisse-sheds-another-5percent-as-traders-digest-emergency-liquidity.html?&qsearchterm=,10,1,428,"-1. Article highlights financial instability, investor concerns, and negative trends in Credit Suisse's performance."
From spying to Swiss bailout: How years of turbulence at Credit Suisse came to a head,"Credit Suisse is currently undergoing a massive strategic overhaul in a bid to address chronic issues.The stock has been in persistent decline since the crisis, against the backdrop of investment banking underperformance and a litany of scandals and risk management failures.On Wednesday evening, Credit Suisse announced that it would exercise its option to borrow up to 50 billion Swiss francs from the Swiss National Bank.Wednesday's close at 1.697 Swiss francs per share was down almost 98% from the stock's all-time high in April 2007.","Credit Suisse received a liquidity lifeline from the Swiss National Bank this week after its share price plunged to an all-time low, but the embattled lender's path to the brink has been a long and tumultuous one. The announcement that Credit Suisse would borrow up to 50 billion Swiss francs ($54 billion) from the central bank came after consecutive sessions of steep drops in its share price. It made Credit Suisse the first major bank to receive such an intervention since the 2008 Global Financial Crisis. The bank's shares ended Wednesday at 1.697 Swiss francs — down almost 98% from the stock's all-time high in April 2007, while credit default swaps, which insure bondholders against a company defaulting, soared to new record highs this week. It comes after years of investment banking underperformance and a litany of scandals and risk management failures. Credit Suisse is currently undergoing a massive strategic overhaul in a bid to address these chronic issues. Current CEO and Credit Suisse veteran Ulrich Koerner took over from Thomas Gottstein in July, as poor investment bank performance and mounting litigation provisions continued to hammer earnings. Gottstein took the reins in early 2020 following the resignation of predecessor Tidjane Thiam in the wake of a bizarre spying scandal, in which UBS-bound former wealth management boss Iqbal Khan was tailed by private contractors allegedly at the direction of former COO Pierre-Olivier Bouee. The saga also saw the suicide of a private investigator and the resignations of a slew of executives. The former head of Credit Suisse's flagship domestic bank widely perceived as a steady hand, Gottstein sought to lay to rest an era plagued by scandal. That mission was short-lived. In early 2021, he found himself dealing with the fallout from two huge crises. The bank's exposure to the collapses of U.S. family hedge fund Archegos Capital and British supply chain finance firm Greensill Capital saddled it with massive litigation and reimbursement costs. These oversight failures resulted in a massive shakeup of Credit Suisse's investment banking, risk and compliance and asset management divisions. In April 2021, former Lloyds Banking Group CEO Antonio Horta-Osorio was brought in to clean up the bank's culture after the string of scandals, announcing a new strategy in November. But in January 2022, Horta-Osorio was forced to resign after being found to have twice violated Covid-19 quarantine rules. He was replaced by UBS executive Axel Lehmann. In February 2022, the bank faced fresh scrutiny after leaked data purported to show it had served human rights abusers, corrupt politicians and sanctioned businessmen for decades. Legacy compliance skeletons also continued to emerge from the closet. In June 2022, Credit Suisse was found guilty in Switzerland's Federal Criminal Court of failing to prevent an alleged Bulgarian cocaine trafficking gang from laundering profits via the bank between 2004 and 2008. With litigation provisions mounting and performance still trailing its peers, the losses deepened in both the company's earnings and its share price. After a 1.593 billion Swiss franc loss in the second quarter of 2022, and two months after Lehmann staunchly denied talks of a change in leadership, Credit Suisse announced that Gottstein would be replaced with Koerner. The bank began another costly sweeping transformation project as Koerner and Lehmann set out to return the embattled lender to long-term stability and profitability. This included the spin-off of Credit Suisse's investment banking division to form U.S.-based CS First Boston, a significant cut in exposure to risk-weighted assets and a $4.2 billion capital raise, which saw the Saudi National Bank take a 9.9% stake to become the largest shareholder. Credit Suisse reported a full-year net loss of 7.3 billion Swiss francs for 2022, predicting another ""substantial"" loss in 2023 before returning to profitability in 2024. Reports of liquidity concerns late in the year led to huge outflows of assets under management, which hit 110.5 billion Swiss francs in the fourth quarter. After yet another sharp share price fall on the back of its annual results in early February, Credit Suisse shares entered March 2023 trading at a paltry 2.85 Swiss francs per share, but things were about to get worse still. On March 9, the company was forced to delay its 2022 annual report after a late call from the U.S. Securities and Exchange Commission relating to a ""technical assessment of previously disclosed revisions to the consolidated cash flow statements"" in 2019 and 2020. The report was eventually published the following Tuesday, and Credit Suisse noted that ""material weaknesses"" were found in its financial reporting processes for 2021 and 2022, though it confirmed that its previously announced financial statements were still accurate. Having already suffered the global risk-off jolt resulting from the collapse of U.S.-based Silicon Valley Bank, the combination of these remarks and confirmation that outflows had not reversed compounded Credit Suisse's share price losses. And on Wednesday, it went into freefall, as top investor the Saudi National Bank said it was not able to provide any more cash to Credit Suisse due to regulatory restrictions. Despite the SNB clarifying that it still believed in the transformation project, shares dived 24% to an all-time low. On Wednesday evening, Credit Suisse announced that it would exercise its option to borrow up to 50 billion Swiss francs from the Swiss National Bank under a covered loan facility and a short-term liquidity facility. The Swiss National Bank and the Swiss Financial Market Supervisory Authority said in a statement Wednesday that Credit Suisse ""meets the capital and liquidity requirements imposed on systemically important banks."" The support from the central bank and reassurance on Credit Suisse's financial position led to a 20% pop in the share price on Thursday, and may have reassured depositors for now. However, analysts suggest questions will remain as to where the market will place the stock's true value for shareholders in the absence of this buffer from the Swiss authorities.",2023-03-17 00:00:00+00:00,https://www.cnbc.com/2023/03/17/credit-suisse-timeline-how-years-of-turbulence-came-to-a-head.html?&qsearchterm=,18,1,979,"-1. Article highlights ongoing crises, scandals, and financial instability at Credit Suisse."
