article_title,article_headline,article_content,text_date,article_url,credit_suisse_count,cs_count,word_count,Sentiment
Credit Suisse faces fresh scrutiny over culture after client data leaks,"The Swiss bank has denied any wrongdoing and said it ""strongly rejects"" the allegations published by dozens of global media outlets following a coordinated investigation.Swiss regulator FINMA has confirmed that it is in contact with the bank over the leaks.The European People's Party — the conservative grouping commanding the largest number of seats in the European Parliament — on Monday urged the European Commission to ""re-evaluate Switzerland as a high-risk money-laundering country.""","LONDON — Credit Suisse is facing fresh scrutiny from Swiss regulators and the European Parliament after leaked data purported to show the bank had served human rights abusers, corrupt politicians and businessmen under sanctions for decades. The Swiss bank has denied any wrongdoing and said it ""strongly rejects"" the allegations published by dozens of global media outlets following a coordinated investigation. The leak of client data was initially sent to a German newspaper before being picked up by the Organized Crime and Corruption Reporting Project and 46 other news organizations. Credit Suisse said the ensuing report, entitled ""Suisse Secrets,"" detailed ""predominantly historical"" matters and was based on ""partial, inaccurate, or selective information taken out of context, resulting in tendentious interpretations of the bank's business conduct."" ""Approximately 90% of the reviewed accounts are today closed or were in the process of closure prior to receipt of the press inquiries, of which over 60% were closed before 2015. Swiss regulator FINMA said it was aware of the articles, though couldn't comment on individual media reports. ""We can confirm that we are in contact with the bank in this context. Compliance with money laundering regulations has been a focus of our supervisory activities for years now. We refer to FINMA's measures and procedures in the context of combating money laundering in recent years,"" FINMA added. Meanwhile, the European People's Party (EPP) — the conservative grouping commanding the largest number of seats in the European Parliament — on Monday urged the European Commission to ""re-evaluate Switzerland as a high-risk money-laundering country,"" suggesting it could be included on the EU's blacklist for countries notorious for laundering dirty money. ""The 'Swiss Secrets' findings point to massive shortcomings of Swiss banks when it comes to the prevention of money laundering,"" said Markus Ferber, the EPPs coordinator on economic affairs. ""When Swiss banks fail to apply international anti-money laundering standards properly, Switzerland itself becomes a high-risk jurisdiction."" In its recent earnings report and in the aftermath of the resignation of its former chairman Antonio Horta-Osorio – who was found to have broken Covid-19 quarantine rules on multiple occasions – Switzerland's second-largest bank had emphasized focus on overhauling its corporate culture. The bank was burned badly by litigation costs in the fourth quarter of 2021 as the fallout continued over its involvement with collapsed U.S. hedge fund Archegos Capital and insolvent supply chain finance company Greensill. This resulted in Credit Suisse setting aside ""major litigation provisions of 1.1 billion Swiss francs ($1.2 billion) and posting a full-year net loss of 1.57 billion Swiss francs for 2021. Credit Suisse also recently became the first Swiss bank to answer criminal charges and faces a court case involving millions of euros in alleged money laundering for drug gangs between 2004 and 2008. A banker accused of money laundering told the court last week that Credit Suisse learned of murders and cocaine trafficking allegedly linked to a Bulgarian mafia organization, but proceeded to manage the cash in question. Both the banker and Credit Suisse deny any wrongdoing. In October 2021, FINMA concluded an investigation into a number of legacy anti-money laundering issues dating back decades before 2014, and some between 2016 and 2019. The regulator imposed measures on the group and continues to track their implementation. Scandals have plagued Credit Suisse for years. Former CEO Tidjane Thiam resigned in early 2020 after a bizarre spying saga that also resulted in the death of a contractor and the ousting of its COO Pierre-Olivier Bouee. Horta-Osorio was brought in to right the ship with regards to corporate culture, only to be forced to step down himself. CEO Thomas Gottstein told CNBC following the bank's latest earnings report that righting risk management and controls was a top priority following a ""challenging year."" Credit Suisse stock is already down more than 9.5% year-to-date and trades at a discount compared to its peers, at around 0.47% of the sector average in Europe. DBRS Morningstar, which covers Credit Suisse stock, told CNBC on Monday that the recent news ""highlights additional risk management shortcomings at Credit Suisse, including anti money laundering procedures and lack of internal controls and management accountability."" ""We consider the news adds to the significant failures observed in 2021 and point to extremely weak risk management and controls at the Group level and across the different businesses, to now include Wealth Management, after the Archegos issue in the Investment bank and the Supply Fund Chains issue in Asset Management,"" Maria Rivas, senior vice president of financial institutions at DBRS Morningstar, told CNBC. ""This is another hit for CSG and the new Chairman and management team, who are trying to make a clean start and announced a 2022 transition year to restore confidence and improve risk management."" Rivas suggested that despite new leadership's focus on overhauling the bank's risk culture and controls, these changes could ""take years to materialize"" given the complexity and scale of the group's global structure. ""Also, there could be further implications for CSG if this is considered a breach of Swiss banking secrecy under the Swiss Banking Act article 47, as it is a federal crime to disclose the information or activity of clients banking domestically to foreign entities,"" she added.",2022-02-22 00:00:00+00:00,https://www.cnbc.com/2022/02/22/credit-suisse-faces-fresh-scrutiny-over-culture-after-client-data-leaks.html?&qsearchterm=,10,0,867,"-1. Article highlights numerous scandals, regulatory scrutiny, and risk management failures at Credit Suisse."
Credit Suisse says U.S. authorities will 'absolutely not' find any wrongdoing amid probe into Russian oligarch record shredding,"Credit Suisse has told CNBC that U.S. authorities will ""absolutely not"" find any evidence of wrongdoing as it faces a probe on its compliance with sanctions on Russian oligarchs.The Swiss bank allegedly asked investors to ""destroy and permanently erase"" documents related to a portfolio of loans backed by yachts and jets potentially belonging to Vladimir Putin's inner circle.""[It] has nothing to do with destroying materials related to sanctions,"" Gottstein told CNBC's Geoff Cutmore.","In this article Credit Suisse told CNBC on Wednesday that U.S. authorities will ""absolutely not"" find any evidence of wrongdoing as it faces a probe of its compliance with sanctions on Russian oligarchs. The Swiss bank is under investigation by the House Oversight Committee over allegations that it asked investors to ""destroy and permanently erase"" documents related to a portfolio of loans backed by yachts and private jets potentially owned by sanctioned Russian oligarchs. Credit Suisse allegedly sent the request to investors following a report first surfaced by the Financial Times that it had offloaded the risks relating to $2 billion of loans to a group of hedge funds. CEO Thomas Gottstein said Wednesday that the letter received by investors had ""nothing to do"" with sanctions or loans belonging to members of President Vladimir Putin's inner circle. ""[It] has nothing to do with destroying materials related to sanctions,"" Gottstein told CNBC's Geoff Cutmore. ""This was a one-off transaction, which was very much a continuation of three other securitized transactions we did before,"" he said. ""It was part of our dealing with private placement investors, institutional investors, and there were absolutely no materials in there that were relevant from a sanctions perspective."" Asked whether the bank had any case to answer, Gottstein said, ""absolutely not."" According to the FT, the request letters were sent during a week in which the U.S., U.K. and EU launched a fresh wave of sanctions against Russia over its unprovoked invasion of Ukraine. Gottstein also defended the bank's position on Russian business, saying that like other major Wall Street and European banks it was scaling back its operations there in the wake of the war. ""As everybody else, we are winding down our Russia business,"" he said, reiterating an announcement made last month. Going forward, Gottstein said the bank would not be taking on ""any new business, any new clients"" from Russia, while also continuing to wind down its exposure to existing Russian clients. ""Our total exposure to Russian clients — that includes Russian clients all over the world, not only the Russian clients in Russia — and we have been reducing this by 56% in terms of our credit exposure,"" he said. The remarks follow the release of Credit Suisse's first-quarter financial results Wednesday, in which it reported a net loss of 273 million Swiss francs ($283.5 million). Russia-related losses accounted for 206 million francs of the losses, while the bank also took a hit of 155 million francs related to the Archegos scandal. Gottstein has previously stated that about 4% of the assets the bank manages in its core wealth management business belong to Russian clients. ""We have roughly 4% of our assets under management in wealth management with Russian clients, be they Russian-domiciled or Russian nationals who live in the West,"" Gottstein said, according to Reuters. That figure has not changed significantly since, the bank said in an update Wednesday.",2022-04-27 00:00:00+00:00,https://www.cnbc.com/2022/04/27/credit-suisse-document-shredding-not-related-to-russia-oligarch-sanctions.html?&qsearchterm=,3,0,487,"-1. Article highlights investigations and allegations against Credit Suisse, portraying a negative sentiment."
Credit Suisse chairman denies reports of talks to replace CEO Gottstein,"Credit Suisse's ninth-largest shareholder, Artisan Partners, has also called for the company to appoint a new CEO, Reuters reported last week.Speaking to CNBC at the World Economic Forum in Davos on Monday, Lehmann said he fully backs Gottstein.","Credit Suisse Chairman Axel Lehmann has denied reports that talks have taken place to explore replacing CEO Thomas Gottstein. Bloomberg News reported earlier this month, citing sources close to the matter, that the Credit Suisse board had held early stage talks on potentially replacing Gottstein at the helm of the embattled Swiss lender, after a string of scandals and mishaps in recent years. Asked directly about the reporting, Lehmann said: ""They didn't speak to me and I know that has not taken place, so it is wrong."" Credit Suisse's ninth-largest shareholder, Artisan Partners, has also called for the company to appoint a new CEO, Reuters reported last week. However, speaking to CNBC at the World Economic Forum in Davos on Monday, Lehmann said he fully backs Gottstein ""because he is good."" ""It is a very challenging situation for the company, but we have a clear plan, we are executing on that plan, so we are rebuilding, basically, the company,"" Lehmann said. ""So in this regard, all the rumors and speculations — I have read them as well — it is rumors and speculations, and by the way, there are other investors that call me and say 'Axel, make sure that you stabilize the company and don't change all the wheels at the same time'."" Gottstein was appointed CEO after the resignation of predecessor Tidjane Thiam in February 2020 following a protracted spying scandal. Credit Suisse reported a net loss for the first quarter of 2022 and announced a management reshuffle as it struggles with litigation costs relating to the Archegos hedge fund collapse, along with the fallout from the war in Ukraine. Follow CNBC International on Twitter and Facebook. ",2022-05-23 00:00:00+00:00,https://www.cnbc.com/2022/05/23/credit-suisse-chairman-denies-reports-of-talks-to-replace-ceo-gottstein.html?&qsearchterm=,4,0,279,"-1. Article highlights leadership disputes, scandals, and financial losses at Credit Suisse."
"Credit Suisse issues profit warning for second quarter, citing Ukraine war and rate hikes","Credit Suisse said despite the trading revenues benefiting from the spike in volatility, the impact of these conditions, combined with ""continued low levels of capital markets issuance"" and widening credit spreads, have ""depressed the financial performance"" of the investment bank in April and May.This is ""likely to lead to a loss for this division as well as a loss for the Group in the second quarter of 2022,"" the trading update said.","Credit Suisse said on Wednesday that it is likely to post a loss for the second quarter as the war in Ukraine and monetary policy tightening squeeze its investment bank. In a trading update early Wednesday morning, the embattled lender said the geopolitical situation, significant monetary tightening from major central banks in response to soaring inflation, and the unwinding of Covid-19 era stimulus measures had caused ""continued heightened market volatility, weak customer flows and ongoing client deleveraging, notably in the APAC region."" Credit Suisse said despite the trading revenues benefiting from the spike in volatility, the impact of these conditions, combined with ""continued low levels of capital markets issuance"" and widening credit spreads, have ""depressed the financial performance"" of the investment bank in April and May. This is ""likely to lead to a loss for this division as well as a loss for the Group in the second quarter of 2022,"" the trading update said. The bank's shares fell more than 5% shortly after markets opened on Wednesday. Credit Suisse has endured a string of scandals and mishaps in recent years, leading some shareholders to call for a change in leadership. Chairman Axel Lehmann told CNBC in May, however, that CEO Thomas Gottstein has his full backing to continue with the ""rebuilding"" of the company. Gottstein took the reins in 2020 following the resignation of predecessor Tidjane Thiam over a protracted spying scandal. The bank reported a net loss for the first quarter of 2022 and announced a management reshuffle as it continues to grapple with litigation costs relating to the Archegos hedge fund collapse. ""We would note that our reported earnings will also be affected by continued volatility in the market value of our 8.6% investment in Allfunds Group,"" the bank added. Spanish wealthtech platform Allfunds Group, which launched on the Euronext Amsterdam in April 2021, has seen its share price plunge 52% year-to-date. Credit Suisse said 2022 will remain a year of ""transition"" for the bank, vowing to accelerate cost-cutting across the group, and will provide further details at its Investor ""Deep Dive"" on June 28. The bank aims to operate a group common equity tier one capital ratio, a measure of bank solvency, of 13.5% in the near-term, in line with its goal of 14% by 2024.",2022-06-15 00:00:00+00:00,https://www.cnbc.com/2022/06/08/credit-suisse-issues-profit-warning-for-second-quarter.html?&qsearchterm=,4,0,380,"-1. Article highlights losses, scandals, and negative market reactions affecting Credit Suisse."
Credit Suisse vows to overhaul its risk management after a litany of scandals,"Credit Suisse vows to forge ahead with its risk management overhaul, despite what its CEO called a ""challenging"" environment.The embattled Swiss lender will hold an Investor Deep Dive event Tuesday, setting out reforms across its risk, compliance, technology and operations functions, along with the wealth management business.Credit Suisse has endured a string of scandals and mishaps in recent years, and reported a net loss for the first quarter of 2022 as it continues to grapple with litigation costs.","Credit Suisse has vowed to forge ahead with its risk management and compliance overhaul in light of a string of scandals, despite what its CEO called a ""challenging"" environment. The embattled Swiss lender will hold an Investor Deep Dive event on Tuesday, setting out its priorities and progress to date in reforms across its risk, compliance, technology and operations functions, along with the wealth management business. Credit Suisse warned earlier this month that it is likely to post a loss for the second quarter, as the war in Ukraine and monetary policy tightening squeeze its investment bank. It comes after a string of scandals and mishaps at the bank in recent years. It reported a net loss for the first quarter of 2022 as it continued to grapple with litigation costs relating to the Archegos hedge fund collapse. The bank saw heavy losses in the wake of the meltdown of U.S. hedge fund Archegos Capital, as it severed ties to the troubled family office. ""Despite the challenging market environment, we remain firmly focused on the execution of our strategic plan during the transition year 2022 and on reinforcing our risk culture – crucially, while staying close to our clients,"" Credit Suisse CEO Thomas Gottstein said in a statement ahead of Tuesday's investor event. ""At the same time, we are continuing to drive the bank's digital transformation, which is key to building a robust, scalable and agile organization that is fit for the future."" In its presentation to investors, the bank outlined how the Archegos collapse highlighted weaknesses in its risk management, where ""outcome sustainability deviated from historical performance."" It was also detail how it has recalibrated its aggregate risk profile to reduce exposure to higher risk areas of the market. Credit Suisse also put forward plans to achieve 200 million Swiss francs ($209.1 million) in cost savings in each of the years 2022 and 2023 by utilizing technology, with a further 400 million francs in the medium-term. The litany of scandals have led some shareholders to call for a change in leadership only two years since Gottstein took over from former CEO Tidjane Thiam, who resigned after a protracted spying saga. However, Chairman Axel Lehmann told CNBC in May that CEO Thomas Gottstein has the board's full backing to continue with the ""rebuilding"" of the company. Meanwhile on Monday, Credit Suisse and a former employee were found guilty by Switzerland's Federal Criminal Court of failing to prevent money-laundering by an alleged Bulgarian cocaine trafficking gang between 2004 and 2008. The trial was the country's first criminal proceeding against one of its major banks.",2022-06-28 00:00:00+00:00,https://www.cnbc.com/2022/06/28/credit-suisse-to-overhaul-its-risk-management-after-archegos-and-other-scandals.html?&qsearchterm=,5,0,433,"-1. Focus on scandals, losses, and challenges highlights a predominantly negative sentiment."
Credit Suisse chairman denies plans to sell or raise capital after mammoth loss,"The bank posted a net loss of 1.593 billion Swiss francs ($1.66 billion) on Wednesday.It also announced the immediate resignation of CEO Thomas Gottstein, who will be replaced by asset management CEO Ulrich Koerner.Asked if he had any plans to sell the company or merge with another bank, Lehmann said ""that is a clear no.""","Credit Suisse Chairman Axel Lehmann denied any intention to sell or merge the embattled Swiss lender after it reported a massive second-quarter loss. The bank posted a net loss of 1.593 billion Swiss francs ($1.66 billion) on Wednesday and announced the immediate resignation of CEO Thomas Gottstein, who will be replaced by asset management CEO Ulrich Koerner. Credit Suisse vowed to ramp up its efforts to overhaul the group's structure in the wake of mounting losses and a string of scandals — most notably the Archegos hedge fund collapse — that have resulted in substantial litigation costs. Speculation has emerged in recent months that Credit Suisse may be considering a capital raise and even a possible sale of the company, but Lehmann told CNBC's Geoff Cutmore Wednesday that neither was in the cards. ""On capital, we reported, despite the loss today, a CET1 ratio of 13.5%. I am happy to see that number and we will guide the market also, in light of the uncertainty, that we are certainly going to defend our CET1 ratio until the end of the year, between 13 and 14%,"" Lehmann said. CET 1, or common equity tier one capital, ratio is a measure of a bank's solvency. ""So I think we are good on that one, and we will manage that very, very tightly."" He also branded some of the speculation — such as the suggestion in a Swiss blog early last month that U.S. bank State Street could be readying a takeover bid for Credit Suisse — as ""quite ridiculous."" Asked if he had any plans to sell the company or merge with another bank, Lehmann said ""that is a clear no."" Credit Suisse has launched a strategic review as it looks to cut costs, redirect its wealth and asset management operations and overhaul its compliance and risk management functions.  In Wednesday's earnings report, the bank said it will provide further details on the progress of the review in the third quarter. ""We will be even more focused going forward on our wealth management franchise, multi-specialist asset manager and the very, very strong Swiss business,"" Lehmann said. ""We will have a highly competitive banking business and we will align the markets business better to serve the needs of our wealth management and Swiss clients."" He added that the board wishes to bring down its absolute cost base to less than 15.5 billion Swiss francs in the medium term. However, Lehmann refused to be drawn on how many job losses this will entail, instead promising more detailed plans for the cost-cutting strategy in the third-quarter earnings. ",2022-07-27 00:00:00+00:00,https://www.cnbc.com/2022/07/27/credit-suisse-chairman-denies-plans-to-sell-or-raise-capital-after-mammoth-loss.html?&qsearchterm=,5,0,432,"-1. Focus on massive losses, resignations, and scandals outweighs restructuring plans and future strategies."
