article_title,article_headline,article_content,text_date,article_url,credit_suisse_count,cs_count,word_count,Sentiment
Tidjane Thiam quits as Credit Suisse CEO following spying scandal,"Credit Suisse CEO Tidjane Thiam is to step down as on Feb. 14 and will be replaced by Thomas Gottstein.Thiam said he was proud of what his team had accomplished during his tenure.The news follows a  drawn-out spying scandal at the bank.An internal investigation by law firm Homburger into the scandal was said to have found ""zero evidence"" that Thiam was aware of the surveillance.","Credit Suisse CEO Tidjane Thiam is stepping down in the wake of a spying scandal and will be replaced by Thomas Gottstein who currently heads the bank's Swiss unit. In a statement Friday morning, the board of directors said it had unanimously accepted Thiam's resignation, following the presentation of the Swiss lender's fourth-quarter and full-year results. Chairman Urs Rohner said Thiam has made an ""enormous contribution"" to the bank since he joined in 2015. He will step down on Feb. 14. ""Under Tidjane's leadership, Credit Suisse simultaneously repurposed our strategy, restored our capital, reduced our costs, de-risked our business, promoted diversity and engendered an exceptional level of co-operation between various divisions,"" he said. ""It is to his credit that Credit Suisse is standing on a very solid foundation and has returned successfully to profit."" Thiam said he was proud of what his team had accomplished during his tenure, adding in a statement that they had ""turned Credit Suisse around"" and that he would be an ""enthusiastic supporter"" of his colleagues' endeavors. The French-Ivorian joined Credit Suisse from Prudential in March 2015. Credit Suisse shares fell 4.2% at the start of Friday's trading session. The news follows a drawn-out spying scandal at the bank, after former wealth management boss Iqbal Khan, who was heading to rival UBS, was followed by private contractors in a bid to establish whether he was poaching colleagues and clients. An internal investigation by law firm Homburger into the scandal which rocked the bank in 2019 was said to have found ""zero evidence"" that Thiam was aware of the surveillance. ""I had no knowledge of the observation of two former colleagues. It undoubtedly disturbed Credit Suisse and caused anxiety and hurt. I regret that this happened and it should never have taken place,"" Thiam reiterated on Friday morning. However, the investigation directly resulted in the exit of COO Pierre-Olivier Bouee, claiming that he acted alone in directing the spying, and raised questions over how Thiam was kept out of the loop in an espionage plot devised and executed by one of his top executives. The scandal also resulted in the suicide of the private investigator who worked as a middleman between Switzerland's second-largest bank and the private security firm. Thiam told CNBC in October that this event was what led to the resignation of individuals. Khan filed a complaint with police in September after reportedly spotting an investigator following him and his wife in Zurich, though conflicting accounts of the incident have emerged. He left Credit Suisse in July following a deterioration of his relationship with Thiam. The saga triggered an investigation from Swiss regulator FINMA into compliance and corporate governance issues associated with the surveillance activities. A spokesperson for the regulator told CNBC on Friday that FINMA ""is continuing its investigations concerning observation activities in order to clarify matters relevant to supervision (namely corporate governance issues)."" The board also voted unanimously to reaffirm its support for Rohner to complete his term as chairman until April 2021. The board's lead independent director, Severin Schwan, said Friday that Rohner has led the board ""commendably during this turbulent time"" and has its ""full support."" Friday's development defies the wishes of the bank's major shareholders, with Harris Associates, Silchester International and U.S. hedge fund Eminence Capital all hoping that Thiam would stay at the bank. Reuters reported, citing sources close to the bank, that the scandal has strained relations between Rohner and Thiam, with the embattled CEO struggling to win the backing of the board despite having shareholders in his corner. Speaking to CNBC Friday, Vontobel Senior Analyst Andreas Venditti said the announcement would likely help to ""calm things down"" but went ""totally against"" the ""very explicit support statements"" from shareholders. In a note following the news, Citi banking analysts suggested that the risk of shareholder rotation and staff departures, including a re-shuffle of senior management, was now on the cards. James Athey, senior investment manager at Aberdeen Standard, told CNBC's ""Street Signs"" on Friday that the key question now is how the leadership structure will take shape. ""If there has been some evidence, where we thought previously that this knowledge hadn't filtered up to that board level and maybe it has, why is the chairman still in place?"" Silchester International declined to comment when approached by CNBC Friday. Harris Associates and Eminence Capital did not immediately respond to requests for comment. Credit Suisse will be looking to put the scandal to bed with the appointment of Gottstein, who has been with the bank for 20 years and has headed up the Swiss domestic market since 2015. During his tenure, the Swiss business increased its contribution to group income before tax from 1.6 billion Swiss francs to 2.1 billion Swiss francs, and several analysts on Friday referred to Gottstein as a ""safe pair of hands."" In a statement Friday, Gottstein thanked Thiam and the board for their support and said he was looking forward to devoting his ""full energy to this treasured bank, its clients and shareholders."" Rohner said Gottstein's ""deep and comprehensive experience"" within the business and ""impressive performance"" as head of the Swiss unit made him a ""strong internal successor"" to Thiam. Full-year figures for Credit Suisse are due Feb. 13.",2020-02-07 00:00:00+00:00,https://www.cnbc.com/2020/02/07/tidjane-thiam-to-step-down-as-credit-suisse-ceo-on-feb-14.html?&qsearchterm=,10,0,873,"-1. Article highlights leadership turmoil and scandal, impacting stock prices and stakeholder confidence."
The 'storm has not receded' for Credit Suisse ahead of Thiam's swan song,"Tidjane Thiam's departure comes amid an investigation by Swiss regulator FINMA following two instances of former Credit Suisse employees, including former wealth boss Iqbal Khan, being placed under surveillance.The outgoing CEO has maintained that he was not aware of the spying operation, which led to the resignation of COO Pierre-Olivier Bouee and the suicide of a private investigator.Thiam is set to deliver the bank's full-year earnings report on Thursday before stepping down at the end of the week.","Credit Suisse CEO Tidjane Thiam will deliver his final earnings report at the helm of the Swiss lender on Thursday, less than a week after his resignation was announced. Thiam's departure comes amid an investigation by Swiss regulator FINMA following two instances of former Credit Suisse employees, including former wealth management boss Iqbal Khan, being placed under surveillance. The outgoing CEO has maintained that he was not aware of the spying operation, which led to the resignation of COO Pierre-Olivier Bouee and the suicide of a private investigator, prompting concerns over how both Thiam and Chairman Urs Rohner were kept out of the loop. Bruno Verstraete, partner at Zurich-based asset manager Lakefield Partners, said the timing of Thiam's ouster had come as a surprise, and suggested that an acceleration of the FINMA investigation could have been the catalyst. ""This spying scandal has gone on for months and what we are seeing is that after the weekend the storm has not really receded, in fact quite the contrary,"" Verstraete told CNBC's ""Squawk Box Europe."" ""It looks as if the pressure now is away from Thiam, who has a good leaver agreement with the bank, and that the pressure is now on the highest organ of the company, which is Rohner."" Severin Schwan, the independent director of the board, said alongside the announcement on Friday that Rohner maintained the board's full backing as chairman until the end of his tenure in April 2021. However, the ousting of Thiam contradicted calls for support for the embattled CEO from major shareholders Eminence Capital, Silchester International and Harris Associates. ""It is very hard to imagine that you don't know about it and that as such is already a bad sign, and did apparently bring FINMA into the game, because as the highest organ you are supposed to know about this,"" Verstraete added. Credit Suisse acknowledged the reputational damage brought about by the spying scandal, but since the news of Khan's complaint to Swiss police emerged in September, the lender's shares are up by around 5% and net inflows have not been impacted materially. Filippo Alloatti, senior credit analyst at Federated Hermes, told CNBC Monday that reputational damage of this magnitude ""takes some time to filter through,"" but added that Thiam's restructuring of the bank had largely been successful in setting the trajectory back toward growth. Credit Suisse reported higher-than-expected net income of 881 million Swiss francs ($886.9 million) for the third quarter of 2019 and doubled its return on tangible equity year-on-year. At the time, the group warned of headwinds from a ""challenging geopolitical environment,"" but some of that risk associated with the U.S.-China trade war and Brexit uncertainty has since abated. The bank's major shareholders have yet to comment on whether they will review their stakes following the announcement of Thiam's departure, and shareholders will be hoping for clues as to the underlying reasons behind the decision on Thursday.",2020-02-10 00:00:00+00:00,https://www.cnbc.com/2020/02/10/the-storm-has-not-receded-for-credit-suisse-ahead-of-thiams-swan-song.html?&qsearchterm=,4,0,485,"-1. Article highlights leadership issues, spying scandal, and regulatory investigation impacting Credit Suisse's reputation."
Credit Suisse posts a 69% jump in annual net profit despite spying scandal,Credit Suisse's latest numbers came in above expectations.The bank surprised investors last week when announcing that CEO Tidjane Thiam is leaving the top position.The resignation came after a drawn-out spying scandal at the bank.,"Credit Suisse beat market expectations with its latest earnings on Thursday, posting a 69% increase in annual net income despite the spying scandal that emerged during 2019. The Swiss lender reported a net income of 3.4 billion Swiss francs ($3.48 billion) for 2019. For the final quarter of the year, the Swiss bank posted a net income of 852 million Swiss francs. Analysts had estimated a net income of 838.5 million Swiss francs for the fourth quarter and 3.2 billion Swiss francs for the year. Here are some other highlights for the year: ""We have started the year strongly across all of our divisions, and as a result, are cautiously optimistic about the prospects for the year ahead,"" the bank said in a statement. Credit Suisse also said it wants to grow its revenues in wealth management in 2020, increase profitability further and keep ""cost discipline."" The bank is proposing a cash dividend of 0.2776 Swiss francs per share for the financial year of 2019. Credit Suisse shares are up by 12% over the past year. The Swiss bank surprised investors last week when announcing that CEO Tidjane Thiam is leaving the top position, effective from Friday. His resignation came after a drawn-out spying scandal at the bank. A former Credit Suisse executive, Iqbal Khan, was followed by private contractors in a bid to establish whether he was poaching colleagues and clients to join him at UBS. An internal investigation by law firm Homburger said there was ""zero evidence"" that Thiam had been involved in the surveillance scheme. Nonetheless, this probe led to the exit of Pierre-Oliver, the bank's chief operating officer, and raised questions as to how Thiam was unaware of the surveillance on Khan. Swiss regulator FINMA is still investigating the incident. Reports suggest there's a power struggle between the bank's chairman, Urs Rohner, and Thiam. Whereas shareholders seem to have supported the work of Thiam as CEO, Credit Suisse's board voted unanimously to keep Rohner. Speaking to CNBC last week, Vontobel Senior Analyst Andreas Venditti said the announcement would likely help to ""calm things down"" but went ""totally against"" the ""very explicit support statements"" from shareholders. Thomas Gottstein, who's been leading the Swiss unit of Credit Suisse, will take over as CEO. Thiam said in a statement Thursday. ""I am proud of what Credit Suisse has achieved during my tenure. We have turned Credit Suisse around, and our 2019 results show we can be sustainably profitable."" He later spoke on why he resigned at a press conference: ""We discussed it with the board, if the board decides there should be a change in leadership, it's my duty to make it happen.""",2020-02-13 00:00:00+00:00,https://www.cnbc.com/2020/02/13/credit-suisse-earnings-q4-2019.html?&qsearchterm=,8,0,444,1. Positive earnings and optimistic outlook overshadowed by CEO resignation and spying scandal.
Credit Suisse says sell-off presents buying opportunity in these Asian tech stocks,"Both multinational and local companies have been affected by the extended shutdown in China, with factories unable to return to full production.Amid the turmoil, Credit Suisse highlighted five Asian tech stocks that have dived from their year-to-date highs, and predicted their potential upside.Downloads and views of online games, fitness apps and live-streaming platforms have all surged, according to reports.","The spread of the coronavirus outbreak has roiled markets in Asia and elsewhere, and hit supply chains globally. Both multinational and local companies have been affected by the extended shutdown in China, with factories unable to return to full production. Last week, Apple warned that it does not expect to meet its quarterly revenue forecast due to lower iPhone supply globally and lower Chinese demand. Apple makes most iPhones and other products in China, and the outbreak had caused it to temporarily halt production and close retail stores in China. That led to a sell-off among Apple suppliers in Asia last week. Amid the turmoil, Credit Suisse highlighted five Asian tech stocks that have dived from their year-to-date highs, and predicted their potential upside. The investment bank rated all five stocks as ""outperform."" 1. Taiwan-listed Hon Hai Precision Industry, better known as Foxconn, and Apple's largest manufacturer Decline from year-to-date high: -12.13%Upside: 22% 2. Hong Kong-listed Sunny Optical, also an Apple supplier Decline from year-to-date high: -12.21%Upside: 21% 3. Taiwan-listed chip supplier Mediatek Decline from year-to-date high: -15.06%Upside: 20% 4. Taiwan-listed ASE Technology, a top chip test and packaging company Decline from year-to-date high: -12.07%Upside: 12% 5. Taiwan-listed electronics manufacturer Delta Electronics Decline from year-to-date high: -6.88% Upside: 13%. *Based on Feb. 27 market close More people staying home — under quarantine orders or just to avoid going out — has boosted online entertainment. Downloads and views of online games, fitness apps and live-streaming platforms have all surged, according to reports. ""E-commerce would further gain market share from offline driven by the dramatic reduction in consumers' outdoor activities. WFH (work from home), remote service and other flexible arrangements ensure little impact on products and service provided, with only logistics as a hurdle in the short term,"" Credit Suisse wrote in a report last week. ""Live streaming and on-line entertainment are gaining good momentum, if (the) right (content is) provided."" With schools shut, online education could be a good bet too, says the investment bank. ""Online education such as K-12 has become a must when schools are closed and also offer lower tier users to get access to best-in-class teachers in tier 1 cities,"" it said. Tier 1 cities in China refers to cities such as Beijing and Shanghai, while K-12 refers to education from kindergarten to grade 12. Credit Suisse picked out three such stocks that investors can play on. 1. New York-listed New Oriental Education, an online education provider in China Decline from year-to-date high: -6:44% Upside: 21% 2. New York-listed Huya, one of the biggest live-streaming game platforms in China Decline from year-to-date high: -11.73% Upside: 47% 3. New York-listed Alibaba, Chinese e-commerce giant Decline from year-to-date high: -11.04% Upside: 34% *Based on Feb. 27 market close",2020-02-28 00:00:00+00:00,https://www.cnbc.com/2020/02/28/credit-suisse-asian-tech-stocks-to-consider-amid-sell-off.html?&qsearchterm=,3,0,459,"1. Article portrays Credit Suisse positively, highlighting their expert analysis and optimistic stock predictions."
Credit Suisse cuts market forecast because of the coronavirus 'global demand shock',"As the coronavirus outbreak continues to weigh on markets, Credit Suisse on Monday cut its market forecast for the year and said that earnings growth for U.S. companies will be near-zero. Chief U.S. equity strategist Johnathan Golub now sees the S&P 500 ending the year at 3,300, up 11% . His prior target was 3,600.""Investor perceptions surrounding the impact of the coronavirus have shifted from a supply chain disruption to a global demand shock,"" Golumb wrote in a note to clients Monday.","As the coronavirus outbreak continues to weigh on markets, Credit Suisse on Monday cut its market forecast for the year and said that earnings growth for U.S. companies will be near-zero.  The firm said that what started as a supply chain disruption has evolved into a ""global demand shock,"" and that there's likely ""further downside to stock prices over the near-term"" before markets turn a corner. Chief U.S. equity strategist Johnathan Golub now sees the S&P 500 ending the year at 3,300, which is about 11% above where the index currently trades. Credit Suisse's prior forecast was 3,600.  The firm also cut its 2020 earnings per share forecast to $165 from $175, for a decline of about 5.7%. U.S. stock futures pointed to sharp losses at the open on Monday, with the major indices set to decline 5% and the Dow Jones Industrial Average tracking for a more than 1,300-point drop. The selling comes as the number of coronavirus cases worldwide rises, and as an oil price war erupted over the weekend, sending crude to multi-year lows. The coronavirus has now infected more than 111,200 people globally, according to data compiled by Johns Hopkins University, with at least 564 reported cases in the U.S. Golub said that the majority of the economic impact from the coronavirus will be felt in the second quarter, before business activity rebounds in the second half of 2020 and into 2021. - CNBC's Michael Bloom contributed reporting.  Subscribe to CNBC PRO for exclusive insights and analysis, and live business day programming from around the world.",2020-03-09 00:00:00+00:00,https://www.cnbc.com/2020/03/09/credit-suisse-cuts-market-forecast-because-of-the-coronavirus-global-demand-shock.html?&qsearchterm=,2,0,260,"-1. Credit Suisse cuts forecasts due to coronavirus impact, expects further stock price declines."
Here are Credit Suisse's 'safe-haven' stock picks to protect against further coronavirus downside,"The current coronavirus outbreak has been called a true ""black swan"" event, meaning an improbable and unforeseen event.""Historically, the market has reacted most negatively to unknown diseases, given the uncertainty associated with them. This can be seen in the recent reaction to COVID-19, as well as the SARS outbreak in 2003,"" Credit Suisse said in a reportThe bank's analysts picked out some ""safe-haven"" stocks in Asia Pacific, for investors looking to ""insulate their portfolios from the additional COVID-19 downside.""","Markets have historically ""reacted most negatively"" to unknown diseases, tending to plunge more during epidemics as compared to natural disasters such as earthquakes and storms, according to Credit Suisse. Disease outbreaks have led to longer market declines and rebounds that are less sharp as compared with crises that are brought on by natural disasters, according to the investment bank, which studied crises in Asia Pacific going back to the year 2000. The current coronavirus outbreak has been called a true ""black swan"" event, meaning an improbable and unforeseen event. It has roiled markets, including those across Asia Pacific, which have declined 10% to 12% from recent highs. Many have fallen into bear territory. ""Historically, the market has reacted most negatively to unknown diseases, given the uncertainty associated with them. This can be seen in the recent reaction to COVID-19, as well as the SARS outbreak in 2003,"" Credit Suisse said in a report released earlier this month. ""Diseases that are better understood, such as the seasonal H1N1 flu, make much less of an impact on markets, despite significantly higher infections and total mortality (albeit with lower mortality rates),"" Credit Suisse analysts Will Stephens, Elita Lai and Dave Yin wrote. If more markets move into the risk-off regime, the bank says it prefers stocks with high dividend and low turnover within Asia (excluding Japan), as well as low volatility, value stocks in China A shares. ""Looking at COVID-19 relative to SARS, risky stocks underperformed, while quality outperformed in both the examples. Value stocks were a safe haven in SARS, but less so now,"" it said. Here are some ""safe-haven"" stocks in Asia Pacific that the bank's analysts picked out for investors looking to ""insulate their portfolios from the additional COVID-19 downside."" These are stocks that Credit Suisse says ""align with the characteristics of previous crisis-outperformers in the region."" Declines calculated from year-to-date high to March 23 close.",2020-03-24 00:00:00+00:00,https://www.cnbc.com/2020/03/24/safe-haven-stock-picks-in-a-coronavirus-crisis-credit-suisse-says.html?&qsearchterm=,4,0,316,"1. Article presents Credit Suisse's expertise and analysis positively, highlighting their strategic recommendations."
